{
  "bundleVersion": 1,
  "caseId": "synthetic-invoice-basic",
  "inputs": {
    "image": {
      "path": "prepared-image.png",
      "sha256": "dda43d98857bc0977a1bdc67e8005428c3af95ca73cddda69c9e8737eee03cc9",
      "mediaType": "image/png"
    },
    "schema": {
      "path": "schema.json",
      "sha256": "48fba5074aa820c5b838e86309c0adc3ee5ecdfd8302ad5360876a54f516258b",
      "mediaType": "application/schema+json"
    },
    "system": {
      "path": "system.txt",
      "sha256": "e73b363c7adaf3d7b7b85c689e0ecd212e545736c7f20de71c7cd558a25f5b9d",
      "mediaType": "text/plain"
    },
    "instruction": {
      "path": "instruction.txt",
      "sha256": "ca3de520e0a497d5ff925ba1cc811ba3b49a7033c9375df89ac2e6c7d9ca009c",
      "mediaType": "text/plain"
    },
    "truth": {
      "path": "truth.json",
      "sha256": "451f35cbd03a9ceb9a2f590fe699d785daffecf7ff187104001a8be36be9e85a",
      "mediaType": "application/json"
    }
  },
  "comparison": {
    "scalars": [
      "/documentKind",
      "/invoiceNumber",
      "/issuedAt",
      "/currency",
      "/totalAmount"
    ],
    "arrays": [
      {
        "path": "/lines",
        "key": "/lineNo",
        "fields": [
          "/description",
          "/quantity",
          "/unitPrice",
          "/amount"
        ]
      }
    ],
    "critical": [
      "/invoiceNumber",
      "/issuedAt",
      "/totalAmount",
      "/lines/*/amount"
    ],
    "normalization": {
      "strings": [
        "nfkc",
        "trim",
        "collapse-whitespace"
      ],
      "numbers": "exact"
    }
  },
  "metadata": {
    "documentKind": "synthetic_invoice",
    "promptVersion": "fixture-v1",
    "preprocessVersion": "fixture-v1",
    "sourceCommit": "synthetic-fixture"
  }
}
